{
  "$schema": "./requestport-cue-reskin-matrix.schema.json",
  "cases": [
    {
      "cleanupOwner": "browser-context",
      "density": "large",
      "engine": "webkit",
      "fixtureOwner": "account-switch-and-sign-out",
      "id": "appearance-0001",
      "lane": "appearance",
      "mode": "dark",
      "pointer": "coarse",
      "scheme": "light",
      "state": "default",
      "surface": "route:/",
      "theme": "cue",
      "viewport": {
        "height": 1024,
        "width": 768
      }
    },
    {
      "cleanupOwner": "browser-context",
      "density": "normal",
      "engine": "chromium",
      "fixtureOwner": "console-hygiene",
      "id": "appearance-0002",
      "lane": "appearance",
      "mode": "light",
      "pointer": "coarse",
      "scheme": "dark",
      "state": "default",
      "surface": "route:/",
      "theme": "cue",
      "viewport": {
        "height": 1024,
        "width": 768
      }
    },
    {
      "cleanupOwner": "browser-context",
      "density": "ultra-compact",
      "engine": "chromium",
      "fixtureOwner": "data-tables",
      "id": "appearance-0003",
      "lane": "appearance",
      "mode": "system",
      "pointer": "fine",
      "scheme": "dark",
      "state": "default",
      "surface": "route:/requests",
      "theme": "cue",
      "viewport": {
        "height": 768,
        "width": 1024
      }
    },
    {
      "cleanupOwner": "browser-context",
      "density": "ultra-compact",
      "engine": "chromium",
      "fixtureOwner": "form-fields",
      "id": "appearance-0004",
      "lane": "appearance",
      "mode": "system",
      "pointer": "fine",
      "scheme": "dark",
      "state": "default",
      "surface": "route:/requests/new",
      "theme": "cue",
      "viewport": {
        "height": 900,
        "width": 1440
      }
    },
    {
      "cleanupOwner": "browser-context",
      "density": "ultra-compact",
      "engine": "chromium",
      "fixtureOwner": "horizontal-overflow",
      "id": "appearance-0005",
      "lane": "appearance",
      "mode": "system",
      "pointer": "coarse",
      "scheme": "dark",
      "state": "default",
      "surface": "route:/requests",
      "theme": "cue",
      "viewport": {
        "height": 844,
        "width": 390
      }
    },
    {
      "cleanupOwner": "browser-context",
      "density": "large",
      "engine": "chromium",
      "fixtureOwner": "hydration-agreement",
      "id": "appearance-0006",
      "lane": "appearance",
      "mode": "system",
      "pointer": "coarse",
      "scheme": "dark",
      "state": "default",
      "surface": "route:/",
      "theme": "dusk",
      "viewport": {
        "height": 844,
        "width": 390
      }
    },
    {
      "cleanupOwner": "browser-context",
      "density": "normal",
      "engine": "webkit",
      "fixtureOwner": "keyboard-focus",
      "id": "appearance-0007",
      "lane": "appearance",
      "mode": "dark",
      "pointer": "coarse",
      "scheme": "light",
      "state": "default",
      "surface": "route:/settings/members",
      "theme": "dusk",
      "viewport": {
        "height": 1024,
        "width": 768
      }
    },
    {
      "cleanupOwner": "browser-context",
      "density": "ultra-compact",
      "engine": "chromium",
      "fixtureOwner": "long-values",
      "id": "appearance-0008",
      "lane": "appearance",
      "mode": "light",
      "pointer": "fine",
      "scheme": "dark",
      "state": "default",
      "surface": "route:/settings/projects",
      "theme": "dusk",
      "viewport": {
        "height": 768,
        "width": 1024
      }
    },
    {
      "cleanupOwner": "browser-context",
      "density": "ultra-compact",
      "engine": "chromium",
      "fixtureOwner": "no-flash-prepaint",
      "id": "appearance-0009",
      "lane": "appearance",
      "mode": "system",
      "pointer": "fine",
      "scheme": "dark",
      "state": "default",
      "surface": "route:/",
      "theme": "dusk",
      "viewport": {
        "height": 900,
        "width": 1440
      }
    },
    {
      "cleanupOwner": "browser-context",
      "density": "large",
      "engine": "chromium",
      "fixtureOwner": "organization-inheritance",
      "id": "appearance-0010",
      "lane": "appearance",
      "mode": "system",
      "pointer": "coarse",
      "scheme": "dark",
      "state": "default",
      "surface": "route:/settings/appearance",
      "theme": "hivehub",
      "viewport": {
        "height": 1024,
        "width": 768
      }
    },
    {
      "cleanupOwner": "browser-context",
      "density": "normal",
      "engine": "chromium",
      "fixtureOwner": "overlay-surfaces",
      "id": "appearance-0011",
      "lane": "appearance",
      "mode": "light",
      "pointer": "fine",
      "scheme": "dark",
      "state": "default",
      "surface": "route:/settings/appearance",
      "theme": "hivehub",
      "viewport": {
        "height": 768,
        "width": 1024
      }
    },
    {
      "cleanupOwner": "browser-context",
      "density": "ultra-compact",
      "engine": "webkit",
      "fixtureOwner": "preference-persistence",
      "id": "appearance-0012",
      "lane": "appearance",
      "mode": "dark",
      "pointer": "coarse",
      "scheme": "light",
      "state": "success",
      "surface": "route:/settings/appearance",
      "theme": "hivehub",
      "viewport": {
        "height": 844,
        "width": 390
      }
    },
    {
      "cleanupOwner": "browser-context",
      "density": "ultra-compact",
      "engine": "chromium",
      "fixtureOwner": "sentinel-redaction",
      "id": "appearance-0013",
      "lane": "appearance",
      "mode": "system",
      "pointer": "fine",
      "scheme": "dark",
      "state": "default",
      "surface": "route:/sign-in",
      "theme": "hivehub",
      "viewport": {
        "height": 900,
        "width": 1440
      }
    },
    {
      "cleanupOwner": "browser-context",
      "density": "large",
      "engine": "chromium",
      "fixtureOwner": "account-switch-and-sign-out",
      "id": "appearance-0014",
      "lane": "appearance",
      "mode": "system",
      "pointer": "coarse",
      "scheme": "dark",
      "state": "default",
      "surface": "route:/",
      "theme": "luma",
      "viewport": {
        "height": 844,
        "width": 390
      }
    },
    {
      "cleanupOwner": "browser-context",
      "density": "normal",
      "engine": "webkit",
      "fixtureOwner": "console-hygiene",
      "id": "appearance-0015",
      "lane": "appearance",
      "mode": "dark",
      "pointer": "coarse",
      "scheme": "light",
      "state": "default",
      "surface": "route:/",
      "theme": "luma",
      "viewport": {
        "height": 1024,
        "width": 768
      }
    },
    {
      "cleanupOwner": "browser-context",
      "density": "ultra-compact",
      "engine": "chromium",
      "fixtureOwner": "data-tables",
      "id": "appearance-0016",
      "lane": "appearance",
      "mode": "light",
      "pointer": "fine",
      "scheme": "dark",
      "state": "default",
      "surface": "route:/requests",
      "theme": "luma",
      "viewport": {
        "height": 768,
        "width": 1024
      }
    },
    {
      "cleanupOwner": "browser-context",
      "density": "ultra-compact",
      "engine": "chromium",
      "fixtureOwner": "form-fields",
      "id": "appearance-0017",
      "lane": "appearance",
      "mode": "system",
      "pointer": "fine",
      "scheme": "dark",
      "state": "default",
      "surface": "route:/requests/new",
      "theme": "luma",
      "viewport": {
        "height": 900,
        "width": 1440
      }
    },
    {
      "cleanupOwner": "browser-context",
      "density": "large",
      "engine": "webkit",
      "fixtureOwner": "horizontal-overflow",
      "id": "appearance-0018",
      "lane": "appearance",
      "mode": "dark",
      "pointer": "fine",
      "scheme": "light",
      "state": "default",
      "surface": "route:/requests",
      "theme": "requestport",
      "viewport": {
        "height": 900,
        "width": 1440
      }
    },
    {
      "cleanupOwner": "browser-context",
      "density": "large",
      "engine": "chromium",
      "fixtureOwner": "hydration-agreement",
      "id": "appearance-0019",
      "lane": "appearance",
      "mode": "light",
      "pointer": "fine",
      "scheme": "dark",
      "state": "default",
      "surface": "route:/",
      "theme": "requestport",
      "viewport": {
        "height": 768,
        "width": 1024
      }
    },
    {
      "cleanupOwner": "browser-context",
      "density": "large",
      "engine": "webkit",
      "fixtureOwner": "keyboard-focus",
      "id": "appearance-0020",
      "lane": "appearance",
      "mode": "system",
      "pointer": "fine",
      "scheme": "dark",
      "state": "default",
      "surface": "route:/settings/members",
      "theme": "requestport",
      "viewport": {
        "height": 900,
        "width": 1440
      }
    },
    {
      "cleanupOwner": "browser-context",
      "density": "large",
      "engine": "chromium",
      "fixtureOwner": "long-values",
      "id": "appearance-0021",
      "lane": "appearance",
      "mode": "system",
      "pointer": "coarse",
      "scheme": "dark",
      "state": "default",
      "surface": "route:/settings/projects",
      "theme": "requestport",
      "viewport": {
        "height": 844,
        "width": 390
      }
    },
    {
      "cleanupOwner": "browser-context",
      "density": "large",
      "engine": "chromium",
      "fixtureOwner": "no-flash-prepaint",
      "id": "appearance-0022",
      "lane": "appearance",
      "mode": "system",
      "pointer": "coarse",
      "scheme": "light",
      "state": "default",
      "surface": "route:/",
      "theme": "requestport",
      "viewport": {
        "height": 844,
        "width": 390
      }
    },
    {
      "cleanupOwner": "browser-context",
      "density": "normal",
      "engine": "chromium",